jBASE,A robust multi-value DBMS comprising development tools and middleware,Multivalue DBMS,,"Score,2.27,Rank,#133,Overall,#3,Multivalue DBMS",www.jbase.com,docs.zumasys.com/jbase,Zumasys,1991.0,5.7,commercial,,no,,,"AIX,Linux,Windows",schema-free,optional,yes,,Embedded SQL for jBASE in BASIC,"JDBC,ODBC,Proprietary protocol,RESTful HTTP API,SOAP-based API",".Net,Basic,Jabbascript,Java",yes,yes,Sharding,yes,no,,no,ACID,yes,yes,yes,Access rights can be defined down to the item level
GridGain,"GridGain is an in-memory computing platform, built on,Apache Ignite","Key-value store,Relational DBMS",,"Score,2.26,Rank,#134,Overall,#26,Key-value stores,#66,Relational DBMS",www.gridgain.com,www.gridgain.com/docs/latest,"GridGain Systems, Inc.",2007.0,GridGain 8.5.1,commercial,,no,,"Java, C++, .Net","Linux,OS X,Solaris,Windows",yes,yes,yes,yes,"ANSI-99 for query and DML statements, subset of DDL","HDFS API,Hibernate,JCache,JDBC,ODBC,Proprietary protocol,RESTful HTTP API,Spring Data","C#,C++,Java,PHP,Python,Ruby,Scala",yes (compute grid and cache interceptors can be used instead),yes (cache interceptors and events),Sharding,yes (replicated cache),yes (compute grid and hadoop accelerator),Immediate Consistency,no,ACID,yes,yes,yes,Security Hooks for custom implementations
TimesTen,"In-Memory,RDBMS,compatible to Oracle",Relational DBMS,,"Score,2.26,Rank,#135,Overall,#67,Relational DBMS",www.oracle.com/database/technologies/related/timesten.html,docs.oracle.com/database/timesten-18.1,"Oracle, TimesTen Performance Software, HP",1998.0,11 Release 2 (11.2.2.8.0),commercial,,no,,,"AIX,HP-UX,Linux,OS X,Solaris SPARC/x86,Windows",yes,yes,no,yes,yes,"JDBC,ODBC,ODP.NET,Oracle Call Interface (OCI)","C,C++,Java,PL/SQL",PL/SQL,no,none,"Multi-source replication,Source-replica replication",no,Immediate Consistency or Eventual Consistency depending on configuration,yes,ACID,yes,yes,yes,fine grained access rights according to SQL-standard
MonetDB,A relational database management system that stores data in columns,Relational DBMS,,"Score,2.26,Rank,#136,Overall,#68,Relational DBMS",www.monetdb.org,www.monetdb.org/Documentation,MonetDB BV,2004.0,"Jul2021-SP2, July 2021",Open Source,Mozilla Public License 2.0,no,,C,"FreeBSD,Linux,OS X,Solaris,Windows",yes,yes,,yes,yes,"JDBC,native C library,ODBC","C,C++,Java,JavaScript (Node.js),Perl,PHP,Python,R,Ruby","yes, in SQL, C, R",yes,Sharding via remote tables,none,no,,yes,ACID,yes,yes,,fine grained access rights according to SQL-standard
QuestDB,"A high performance open source SQL database for,time series data",Time Series DBMS,,"Score,2.24,Rank,#137,Overall,#10,Time Series DBMS",questdb.io,questdb.io/docs/introduction,QuestDB Limited,2014.0,,Open Source,Apache 2.0,no,,Java,"Linux,macOS,Windows",yes,yes,no,no,SQL-like query language,"HTTP REST,InfluxDB Line Protocol (TCP/UDP),JDBC","C,C++,Go,Java,JavaScript (Node.js),Python,Rust",no,no,horizontal partitioning (by timestamps),Configurable consistency for N replicas,no,Immediate Consistency,no,ACID for single-table writes,yes,yes,yes,
SpatiaLite,"Spatial extension of,SQLite",Spatial DBMS,,"Score,2.18,Rank,#138,Overall,#3,Spatial DBMS",www.gaia-gis.it/fossil/libspatialite/index,www.gaia-gis.it/gaia-sins/spatialite_topics.html,Alessandro Furieri,2008.0,"5.0.0, August 2020",Open Source,"MPL 1.1, GPL v2.0 or LGPL v2.1",no,,C++,server-less,yes,yes,no,yes,yes,,,no,yes,none,none,no,,yes,ACID,yes,yes,yes,no
Tibero,"A secure RDBMS, designed for easy portability from Oracle",Relational DBMS,,"Score,2.18,Rank,#139,Overall,#69,Relational DBMS",www.tmaxsoft.com/products/tibero,technet.tmaxsoft.com/upload/download/online/tibero/pver-20150504-000002/index.html,TmaxSoft,2003.0,"6, April 2015",commercial,,no,,C and Assembler,"AIX,HP-UX,Linux,Solaris,Windows",yes,yes,yes,yes,yes,"JDBC,ODBC,ODP.NET,Oracle Call Interface (OCI),Tibero CLI","C,C#,C++,Cobol,Java,Objective-C,Perl,PHP,Python,Ruby,Visual Basic",Persistent Stored Procedure (PSM),yes,horizontal partitioning,"Multi-source replication,Source-replica replication",no,Immediate Consistency,yes,ACID,yes,yes,no,"fine grained access rights according to SQL-standard (SQL 92, SQL 99)"
OpenTSDB,"Scalable Time Series DBMS based on,HBase",Time Series DBMS,,"Score,2.18,Rank,#140,Overall,#11,Time Series DBMS",opentsdb.net,opentsdb.net/docs/build/html/index.html,currently maintained by Yahoo and other contributors,2011.0,,Open Source,LGPL,no,,Java,"Linux,Windows",schema-free,"numeric data for metrics, strings for tags",no,no,no,"HTTP API,Telnet API","Erlang,Go,Java,Python,R,Ruby",no,no,Sharding,selectable replication factor,no,Immediate Consistency,no,no,yes,yes,no,no
NebulaGraph,"A distributed, linear scalable, high perfomant,Graph DBMS",Graph DBMS,,"Score,2.17,Rank,#141,Overall,#9,Graph DBMS","github.com/vesoft-inc/nebula,nebula-graph.io",docs.nebula-graph.io,Vesoft Inc.,2019.0,,Open Source,Apache Version 2.0 + Common Clause 1.0,no,,C++,Linux,Strong typed schema,yes,no,yes,SQL-like query language,"Browser interface,console (shell),Cypher Query Language,GO Object Graph Mapper,Java Object Graph Mapper,NGBatis,Proprietary native API,Python Object Graph Mapper,Query language nGQL",".Net,C++,Go,Java,PHP,Python",user defined functions,,Sharding,Causal Clustering using Raft protocol,no,Immediate Consistency,yes,ACID,yes,yes,yes,Role-based access control
VoltDB,"Distributed In-Memory NewSQL,RDBMS",Relational DBMS,,"Score,2.13,Rank,#142,Overall,#70,Relational DBMS",www.voltdb.com,docs.voltdb.com,VoltDB Inc.,2010.0,,Open Source,"AGPL for Community Edition, commercial license for Enterprise, AWS, and Pro Editions",no,,"Java, C++","Linux,OS X",yes,yes,,yes,yes,"Java API,JDBC,RESTful HTTP/JSON API","C#,C++,Erlang,Go,Java,JavaScript,PHP,Python",Java,no,Sharding,"Multi-source replication,Source-replica replication",no,,no,ACID,yes,yes,,Users and roles with access to stored procedures
Memgraph,An open source graph database built for real-time streaming and compatible with Neo4j,Graph DBMS,,"Score,2.12,Rank,#143,Overall,#10,Graph DBMS",memgraph.com,docs.memgraph.com,Memgraph Ltd,2017.0,,commercial,Free license available,no,,C and C++,Linux,schema-free and schema-optional,yes,no,,no,"Bolt protocol,Cypher query language",".Net,C,C++,Elixir,Go,Haskell,Java,JavaScript,PHP,Python,Ruby,Scala",,,Sharding,Multi-source replication using RAFT,no,Immediate Consistency,yes,ACID,"yes, multi-version concurrency control (MVCC)",yes,yes,"Users, roles and permissions"
Db4o,,Object oriented DBMS,,"Score,2.05,Rank,#144,Overall,#3,Object oriented DBMS",sourceforge.net/projects/db4o,,,2001.0,,Open Source,commercial license available for existing customers only,no,,,,,,,,,,,,,,,,,,,,,,
Datomic,"Datomic builds on immutable values, supports point-in-time queries and uses 3rd party systems for durability",Relational DBMS,,"Score,2.03,Rank,#145,Overall,#71,Relational DBMS",www.datomic.com,docs.datomic.com,Cognitect,2012.0,,commercial,limited edition free,no,,"Java, Clojure",All OS with a Java VM,yes,yes,no,yes,no,RESTful HTTP API,"Clojure,Java",yes,By using transaction functions,none,none,no,Immediate Consistency,no,ACID,yes,yes,yes,no
TigerGraph,"A complete, distributed, parallel graph computing platform supporting web-scale data analytics in real-time",Graph DBMS,,"Score,2.03,Rank,#146,Overall,#11,Graph DBMS",www.tigergraph.com,docs.tigergraph.com,,2017.0,,commercial,,no,,C++,Linux,yes,yes,no,,SQL-like query language (GSQL),"GSQL (TigerGraph Query Language),Kafka,RESTful HTTP/JSON API","C++,Java",yes,no,,,yes,,yes,ACID,yes,yes,no,Role-based access control
GridDB,Scalable in-memory time series database optimized for IoT and Big Data,Time Series DBMS,,"Score,2.02,Rank,#147,Overall,#12,Time Series DBMS",griddb.net,docs.griddb.net,Toshiba Corporation,2013.0,,Open Source,"AGPL version 3 and Apache License, version 2.0 , commercial license (standard and advanced editions) also available",no,,C++,Linux,yes,yes,no,yes,"SQL92, SQL-like TQL (Toshiba Query Language)","JDBC,ODBC,Proprietary protocol,RESTful HTTP/JSON API","C,C++,Go,Java,JavaScript (Node.js),Perl,PHP,Python,Ruby",no,yes,Sharding,Source-replica replication,Connector for using GridDB as an input source and output destination for Hadoop MapReduce jobs,"Immediate consistency within container, eventual consistency across containers",no,ACID at container level,yes,yes,yes,Access rights for users can be defined per database
Mnesia,,Document store,,"Score,2.01,Rank,#148,Overall,#24,Document stores",erlang.org/doc/man/mnesia.html,,,1999.0,,Open Source,proprietary license,no,,Erlang,,,,,,,,,,,,,,,,,,,,
IBM Db2 warehouse,Cloud-based data warehousing service,Relational DBMS,,"Score,2.00,Rank,#149,Overall,#72,Relational DBMS",www.ibm.com/products/db2-warehouse,,IBM,2014.0,,commercial,,yes,,,hosted,yes,yes,no,yes,yes,".NET Client API,JDBC,ODBC,OLE DB","Java,JavaScript (Node.js),Perl,PHP,Python,R,Ruby","PL/SQL, SQL PL",yes,Sharding,yes,no,Immediate Consistency,yes,ACID,yes,yes,yes,fine grained access rights according to SQL-standard
BaseX,"Light-weight,Native XML DBMS,with support for XQuery 3.0 and interactive GUI.",Native XML DBMS,,"Score,1.96,Rank,#150,Overall,#4,Native XML DBMS",basex.org,docs.basex.org,BaseX GmbH,2007.0,,Open Source,BSD license,no,,Java,"Linux,OS X,Windows",schema-free,no,,yes,no,"Java API,RESTful HTTP API,RESTXQ,WebDAV,XML:DB,XQJ","Actionscript,C,C#,Haskell,Java,JavaScript,Lisp,Perl,PHP,Python,Qt,Rebol,Ruby,Scala,Visual Basic",yes,yes,none,none,no,,no,"multiple readers, single writer",yes,yes,,Users with fine-grained authorization concept on 4 levels
ObjectStore,,Object oriented DBMS,,"Score,1.96,Rank,#151,Overall,#4,Object oriented DBMS",ignitetech.com/objectstore,,Ignite Technologies,1988.0,,commercial,,no,,,,,,,,,,,,,,,,,,,,,,
Empress,,Relational DBMS,,"Score,1.92,Rank,#152,Overall,#73,Relational DBMS",www.empress.com,,,1981.0,,commercial,,no,,,,,,,,,,,,,,,,,,,,,,
Actian NoSQL Database,,Object oriented DBMS,,"Score,1.87,Rank,#153,Overall,#5,Object oriented DBMS",www.actian.com/data-management/nosql-object-database,,Actian,1988.0,,commercial,,no,,,,,,,,,,,,,,,,,,,,,,
Amazon DocumentDB,"Fast, scalable, highly available, and fully managed,MongoDB,-compatible database service",Document store,,"Score,1.83,Rank,#154,Overall,#25,Document stores",aws.amazon.com/documentdb,aws.amazon.com/documentdb/resources,,2019.0,,commercial,,yes,,,hosted,schema-free,yes,no,yes,no,proprietary protocol using JSON (MongoDB compatible),"Go,Java,JavaScript (Node.js),PHP,Python",no,no,none,"Multi-availability zones for high availability, asynchronous replication for up to 15 read replicas",no,Immediate Consistency,no,Atomic single-document operations,yes,yes,,Access rights for users and roles
SQLBase,,Relational DBMS,,"Score,1.81,Rank,#155,Overall,#74,Relational DBMS",www.opentext.com/what-we-do/products/specialty-technologies/opentext-gupta-development-tools-databases/opentext-gupta-sqlbase,,,1985.0,,commercial,,no,,,,,,,,,,,,,,,,,,,,,,
Tarantool,In-memory computing platform with a flexible data schema for efficiently building high-performance applications,Key-value store,,"Score,1.80,Rank,#156,Overall,#27,Key-value stores",www.tarantool.io,www.tarantool.io/en/doc,VK,2008.0,,Open Source,BSD,no,,C and C++,"BSD,Linux,macOS","schema-free, schema definition possible","string, double, decimal, uuid, integer, blob, boolean",no,yes,Full-featured ANSI SQL support,Open binary protocol,"C,C#,C++,Erlang,Go,Java,JavaScript,Lua,Perl,PHP,Python,Rust","Lua, C and SQL stored procedures",yes,Hash sharding based on virtual buckets,"Multi-source replication,Source-replica replication",,Immediate Consistency,"yes, with SQL","ACID, read commited","yes, cooperative multitasking","yes, regular snapshots on disk, write ahead logging","yes, full featured in-memory storage engine with persistence",Access rights for users and roles
NonStop SQL,,Relational DBMS,,"Score,1.78,Rank,#157,Overall,#75,Relational DBMS",www.hpe.com/us/en/servers/nonstop.html,,"HP, originally by Tandem",1987.0,,commercial,,no,,,,,,,,,,,,,,,,,,,,,,
Fauna,"Fauna provides a web-native interface, with support for GraphQL and custom business logic that integrates seamlessly with the rest of the serverless ecosystem. The underlying globally distributed storage and compute platform is fast, consistent, and reliable, with a modern security infrastructure.","Document store,Graph DBMS,Relational DBMS,Time Series DBMS",,"Score,1.74,Rank,#158,Overall,#26,Document stores,#12,Graph DBMS,#76,Relational DBMS,#13,Time Series DBMS",fauna.com,docs.fauna.com,"Fauna, Inc.",2014.0,,commercial,,yes,,Scala,hosted,schema-free,no,no,yes,no,RESTful HTTP API,"C#,Go,Java,JavaScript,Python,Ruby,Scala,Swift",user defined functions,no,horizontal partitioning,Multi-source replication,no,Immediate Consistency,yes,ACID,yes,yes,no,"Identity management, authentication, and access control"
Cubrid,CUBRID is an open-source SQL-based relational database management system with object extensions for OLTP,Relational DBMS,,"Score,1.72,Rank,#159,Overall,#77,Relational DBMS","cubrid.com,(korean),cubrid.org,(english)",cubrid.org/manuals,"CUBRID Corporation, CUBRID Foundation",2008.0,,Open Source,Apache Version 2.0,no,,"C, C++, Java","Linux,Windows",yes,yes,no,yes,yes,"ADO.NET,JDBC,ODBC,OLE DB","C,C#,C++,Go,Java,JavaScript (Node.js),Perl,PHP,Python,Ruby",Java Stored Procedures,yes,none,Source-replica replication,no,Immediate Consistency,yes,ACID,yes,yes,no,fine grained access rights according to SQL-standard
Stardog,"Enterprise Knowledge Graph platform and graph DBMS with high availability, high performance reasoning, and virtualization","Graph DBMS,RDF store",,"Score,1.71,Rank,#160,Overall,#13,Graph DBMS,#6,RDF stores",www.stardog.com,docs.stardog.com,Stardog-Union,2010.0,,commercial,60-day fully-featured trial license; 1-year fully-featured non-commercial use license for academics/students,no,,Java,"Linux,macOS,Windows",schema-free and OWL/RDFS-schema support,yes,no,yes,"Yes, compatible with all major SQL variants through dedicated BI/SQL Server","GraphQL query language,HTTP API,Jena RDF API,OWL,RDF4J API,Sesame REST HTTP Protocol,SNARL,SPARQL,Spring Data,Stardog Studio,TinkerPop 3",".Net,Clojure,Groovy,Java,JavaScript,Python,Ruby","user defined functions and aggregates, HTTP Server extensions in Java",yes,none,Multi-source replication in HA-Cluster,no,Immediate Consistency in HA-Cluster,yes,ACID,yes,yes,yes,Access rights for users and roles
Firebolt,Highly scalable cloud data warehouse and analytics product,Relational DBMS,,"Score,1.71,Rank,#161,Overall,#78,Relational DBMS",www.firebolt.io,docs.firebolt.io,Firebolt Analytics Inc.,2020.0,,commercial,,yes,,,hosted,yes,yes,,yes,yes,".Net,ODBC,RESTful HTTP API","Go,JavaScript (Node.js),Python",no,no,,depending on storage layer,,,,,,,,
Matisse,Object oriented DBMS providing ANSI SQL,Object oriented DBMS,,"Score,1.70,Rank,#162,Overall,#6,Object oriented DBMS",www.matisse.com,www.matisse.com/developers/documentation,Matisse Software Inc.,1986.0,,commercial,free developer license available,no,,,,,,,,,,,,,,,,,,,,,,
ObjectBox,"Extremely fast embedded database for small devices, IoT and Mobile",Object oriented DBMS,,"Score,1.66,Rank,#163,Overall,#7,Object oriented DBMS",objectbox.io,docs.objectbox.io,ObjectBox Limited,2017.0,,Open Source,Apache License 2.0,no,,C and C++,"Android,iOS,Linux,macOS,Windows",yes,yes,no,yes,no,Proprietary native API,"C,C++,Dart,Go,Java,JavaScript,Kotlin,Python,Swift",no,no,none,online/offline synchronization between client and server,no,Immediate Consistency,yes,ACID,yes,yes,no,yes
Dgraph,"Distributed and scalable native,Graph DBMS",Graph DBMS,,"Score,1.65,Rank,#164,Overall,#14,Graph DBMS",dgraph.io,dgraph.io/docs,"Dgraph Labs, Inc.",2016.0,,Open Source,Apache 2.0,no,,Go,"Linux,OS X,Windows",schema-free,yes,no,yes,no,"GraphQL query language,gRPC (using protocol buffers) API,HTTP API","C#,C++,Go,Java,JavaScript (Node.js),PHP,Python,Ruby",no,no,yes,Synchronous replication via Raft,no,Immediate Consistency,no,ACID,yes,yes,,no
Oracle Rdb,,Relational DBMS,,"Score,1.65,Rank,#165,Overall,#79,Relational DBMS",www.oracle.com/technetwork/database/database-technologies/rdb/overview/index.html,,"Oracle, originally developed by Digital Equipment Corporation (DEC)",1984.0,"7.4.1.1, 2021",commercial,,no,,,HP Open VMS,"Flexible Schema (defined schema, partial schema, schema free)",yes,no,yes,yes,,,,,,,no,Immediate Consistency,yes,"yes, on a single node",yes,yes,no,
Apache Kylin,"A distributed analytics engine for big data, providing a SQL interface and multi-dimensional analysis (OLAP) and leveraging the Hadoop stack",Relational DBMS,,"Score,1.64,Rank,#166,Overall,#80,Relational DBMS",kylin.apache.org,kylin.apache.org/docs,"Apache Software Foundation, originally contributed from eBay Inc",2015.0,"3.1.0, July 2020",Open Source,Apache Version 2.0,no,,Java,Linux,yes,yes,no,yes,ANSI SQL for queries (using Apache Calcite),"JDBC,ODBC,RESTful HTTP API",,,,,,yes,Immediate Consistency,,,yes,yes,no,
Datameer,,Document store,,"Score,1.61,Rank,#167,Overall,#27,Document stores",www.datameer.com,,,2009.0,,commercial,,no,,,,,,,,,,,,,,,,,,,,,,
GT.M,,Key-value store,,"Score,1.60,Rank,#168,Overall,#28,Key-value stores",sourceforge.net/projects/fis-gtm,,,1986.0,"7.0-000, February 2021",commercial,,no,,,,,,,,,,,,,,,,,,,,,,
LiteDB,"MongoDB-like, serverless database delivered in a single DLL",Document store,,"Score,1.59,Rank,#169,Overall,#28,Document stores",www.litedb.org,github.com/mbdavid/LiteDB/wiki,Mauricio David,2014.0,,Open Source,MIT License,no,,C#,,,,,,,,,,,,,,,,,,,,
DataEase,,Relational DBMS,,"Score,1.55,Rank,#170,Overall,#81,Relational DBMS",www.dataease.com,,,1981.0,,commercial,,no,,,,,,,,,,,,,,,,,,,,,,
ZODB,Native object database for Python,Key-value store,,"Score,1.52,Rank,#171,Overall,#29,Key-value stores",zodb.org,,,2009.0,"5.6.0, June 2020",Open Source,,no,,,,,,,,,,,,,,,,,,,,,,
Apache HAWQ,HAWQ is a parallel SQL query engine integrated into the Hadoop ecosystem,Relational DBMS,,"Score,1.51,Rank,#172,Overall,#82,Relational DBMS",hawq.apache.org,hawq.apache.org/docs/userguide/latest,Pivotal Software; Apache,2012.0,,Open Source,,no,,,,,,,,,,,,,,,,,,,,,,
MatrixOne,"A Hyperconverged Cloud & Edge Native DBMS, supporting transactional, analytical, and streaming workloads with a simplified and distributed database engine, across multiple data centers, clouds, edges and other heterogenous infrastructures.",Relational DBMS,,"Score,1.51,Rank,#173,Overall,#83,Relational DBMS",www.matrixorigin.io,docs.matrixorigin.io,,2021.0,,Open Source,Apache Version 2.0,no,,,,,,,,,,,,,,,,,,,,,,
Altibase,"An enterprise grade, high-performance,RDBMS",Relational DBMS,,"Score,1.51,Rank,#174,Overall,#84,Relational DBMS",altibase.com,github.com/ALTIBASE/Documents/tree/master/Manuals,Altibase,1999.0,"v7.1.0.5.3, March 2021",Open Source,since February 2018,no,,C++,"AIX,HP-UX,Linux",yes,yes,no,yes,ANSI SQL-92,"JDBC,ODBC,Proprietary protocol","C,C++,Java",stored procedures and stored functions,yes,Sharding,yes,no,Immediate Consistency,yes,ACID,yes,yes,yes,fine grained access rights according to SQL-standard
FoundationDB,Ordered key-value store. Core features are complimented by layers.,"Document store,Key-value store,Relational DBMS",,"Score,1.48,Rank,#175,Overall,#29,Document stores,#30,Key-value stores,#85,Relational DBMS",github.com/apple/foundationdb,apple.github.io/foundationdb,FoundationDB,2013.0,"6.2.28, November 2020",Open Source,Apache 2.0,no,,C++,"Linux,OS X,Windows",schema-free,no,,no,supported in specific SQL layer only,,".Net,C,C++,Go,Java,JavaScript,PHP,Python,Ruby,Swift",in SQL-layer only,no,Sharding,yes,no,Linearizable consistency,in SQL-layer only,ACID,yes,yes,,no
mSQL,"mSQL (Mini SQL) is a simple and lightweight,RDBMS",Relational DBMS,,"Score,1.47,Rank,#176,Overall,#86,Relational DBMS",hughestech.com.au/products/msql,,Hughes Technologies,1994.0,"4.4, October 2021",commercial,free licenses can be provided,no,,C,"AIX,HP-UX,Linux,OS X,Solaris SPARC/x86,Windows",yes,yes,no,yes,A subset of ANSI SQL is implemented,"JDBC,ODBC","C,C++,Delphi,Java,Perl,PHP,Tcl",no,no,none,none,no,none,no,no,no,yes,no,no
Pinecone,"A managed, cloud-native vector database",Search engine,,"Score,1.47,Rank,#177,Overall,#13,Search engines",www.pinecone.io,docs.pinecone.io/docs/overview,"Pinecone Systems, Inc",2019.0,,commercial,,yes,,,hosted,,"String, Number, Boolean",no,,no,RESTful HTTP API,Python,,,,,no,,,,yes,yes,no,
GigaSpaces,"High performance in-memory data grid platform, powering three products: Smart Cache, Smart ODS (Operational Data Store), Smart Augmented Transactions","Document store,Object oriented DBMS",,"Score,1.46,Rank,#178,Overall,#30,Document stores,#8,Object oriented DBMS",www.gigaspaces.com,docs.gigaspaces.com/latest/landing.html,Gigaspaces Technologies,2000.0,"15.5, September 2020",Open Source,Apache Version 2; Commercial licenses available,no,,"Java, C++, .Net","Linux,macOS,Solaris,Windows",schema-free,yes,no,yes,SQL-99 for query and DML statements,"GigaSpaces LRMI,Hibernate,JCache,JDBC,JPA,ODBC,RESTful HTTP API,Spring Data",".Net,C++,Java,Python,Scala",yes,"yes, event driven architecture",Sharding,"Multi-source replication,Source-replica replication",yes,Immediate Consistency,no,ACID,yes,yes,yes,Role-based access control
GBase,An analytical database for business intelligence with large customers in China.,Relational DBMS,,"Score,1.43,Rank,#179,Overall,#87,Relational DBMS",www.gbase8a.com,,,,GBase 8a,commercial,,no,,,,,,,,,,,,,,,,,,,,,,
Model 204,,Multivalue DBMS,,"Score,1.41,Rank,#180,Overall,#4,Multivalue DBMS",www.rocketsoftware.com/products/rocket-m204,,,1972.0,,commercial,,no,,,"HP Open VMS,z/OS",,,,,,,,,,,,,,,,,,,
EventStoreDB,,Event Store,,"Score,1.39,Rank,#181,Overall,#1,Event Stores",www.eventstore.com,,,2012.0,,Open Source,,no,,,"Linux,Windows",,,,,,,,,,,,,,,,,,,
IDMS,,Navigational DBMS,,"Score,1.39,Rank,#182,Overall,#2,Navigational DBMS",www.ca.com/us/products/ca-idms.html,,,1973.0,,commercial,,no,,,,,,,,,,,,,,,,,,,,,,
Giraph,,Graph DBMS,,"Score,1.38,Rank,#183,Overall,#15,Graph DBMS",giraph.apache.org,,,2013.0,,Open Source,Apache Version 2,no,,,,,,,,,,,,,,,,,,,,,,
Xapian,,Search engine,,"Score,1.37,Rank,#184,Overall,#14,Search engines",xapian.org,,,1986.0,,Open Source,GPLv2,no,,,,,,,,,,,,,,,,,,,,,,
NuoDB,,Relational DBMS,,"Score,1.35,Rank,#185,Overall,#88,Relational DBMS",nuodb.com,,,2013.0,,commercial,limited edition free,no,,,"hosted,Linux,OS X,Windows",,,,,,,,,,,,,,,,,,,
NCache,,Key-value store,,"Score,1.33,Rank,#186,Overall,#31,Key-value stores",www.alachisoft.com/ncache,,,2005.0,,Open Source,Enterprise Edition available,no,"NCache Cloud,: NCache Cloud is available in Azure and AWS Marketplaces as a Service. This means you can now obtain it instantaneously with a few mouse clicks, and seamlessly scale your cache deployment without any down time.",,"Linux,Windows",,,,,,,,,,,,,,,,,,,
openGauss,,Relational DBMS,,"Score,1.32,Rank,#187,Overall,#89,Relational DBMS","gitee.com/opengauss,opengauss.org",,,2019.0,,Open Source,,no,,,Linux,,,,,,,,,,,,,,,,,,,
Infobright,,Relational DBMS,,"Score,1.30,Rank,#188,Overall,#90,Relational DBMS",ignitetech.com/softwarelibrary/infobrightdb,,,2005.0,,commercial,The open source (GPLv2) version did not support inserts/updates/deletes and was discontinued with July 2016,no,,,"Linux,Windows",,,,,,,,,,,,,,,,,,,
HFSQL,,Relational DBMS,,"Score,1.29,Rank,#189,Overall,#91,Relational DBMS",windev.com/pcsoft/hfsql.htm,,,,,commercial,,no,,,"Android,iOS,Linux,OS X,Windows",,,,,,,,,,,,,,,,,,,
Sedna,,Native XML DBMS,,"Score,1.29,Rank,#190,Overall,#5,Native XML DBMS",sourceforge.net/projects/sedna,,,2006.0,,Open Source,Apache Version 2,no,,,,,,,,,,,,,,,,,,,,,,
AllegroGraph,,"Document store,Graph DBMS,RDF store",,"Score,1.29,Rank,#191,Overall,#31,Document stores,#16,Graph DBMS,#7,RDF stores",allegrograph.com,,,2004.0,,commercial,Limited community edition free,no,,,"Linux,OS X,Windows",,,,,,,,,,,,,,,,,,,
Meilisearch,,Search engine,,"Score,1.28,Rank,#192,Overall,#15,Search engines","github.com/meilisearch/meilisearch,www.meilisearch.com",,,2020.0,,Open Source,MIT License,no,,,,,,,,,,,,,,,,,,,,,,
Northgate Reality,,Multivalue DBMS,,"Score,1.28,Rank,#193,Overall,#5,Multivalue DBMS",reality.necsws.com,,,1973.0,,commercial,,no,,,,,,,,,,,,,,,,,,,,,,
TypeDB,,"Graph DBMS,Relational DBMS",,"Score,1.25,Rank,#194,Overall,#17,Graph DBMS,#92,Relational DBMS",vaticle.com,,,2016.0,,Open Source,"GPL Version 3, commercial licenses available",no,,,"Linux,OS X,Windows",,,,,,,,,,,,,,,,,,,
RDF4J,,RDF store,,"Score,1.24,Rank,#195,Overall,#8,RDF stores",rdf4j.org,,,2004.0,,Open Source,"Eclipse Distribution License (EDL), v1.0.",no,,,"Linux,OS X,Unix,Windows",,,,,,,,,,,,,,,,,,,
Perst,,Object oriented DBMS,,"Score,1.22,Rank,#196,Overall,#9,Object oriented DBMS",www.mcobject.com/perst,,,2003.0,,Open Source,commercial license available,no,,,,,,,,,,,,,,,,,,,,,,
HPE Ezmeral Data Fabric,,"Document store,Wide column store",,"Score,1.22,Rank,#197,Overall,#32,Document stores,#9,Wide column stores",www.hpe.com/us/en/software/data-fabric.html,,,2009.0,,commercial,,no,,,,,,,,,,,,,,,,,,,,,,
solidDB,,Relational DBMS,,"Score,1.17,Rank,#198,Overall,#93,Relational DBMS",teamblue.unicomsi.com/products/soliddb,,,1992.0,,commercial,,no,,,,,,,,,,,,,,,,,,,,,,
D3,,Multivalue DBMS,,"Score,1.16,Rank,#199,Overall,#6,Multivalue DBMS",www.rocketsoftware.com/products/rocket-d3,,,1999.0,,commercial,,no,,,,,,,,,,,,,,,,,,,,,,
Blazegraph,,"Graph DBMS,RDF store",,"Score,1.16,Rank,#200,Overall,#18,Graph DBMS,#9,RDF stores",blazegraph.com,,,2006.0,,Open Source,extended commercial license available,no,,,"Linux,OS X,Windows",,,,,,,,,,,,,,,,,,,
DBISAM,RDBMS mainly geared to Delphi and C++Builder application developers,Relational DBMS,,"Score,1.16,Rank,#201,Overall,#94,Relational DBMS",www.elevatesoft.com/products?category=dbisam,,"Elevate Software, Inc.",1998.0,,commercial,,no,,,,,,,,,,,,,,,,,,,,,,
