Ignite,"Apache Ignite is a memory-centric distributed database, caching, and processing platform for transactional, analytical, and streaming workloads, delivering in-memory speeds at petabyte scale.","Key-value store,Relational DBMS",,"Score,5.32,Rank,#78,Overall,#9,Key-value stores,#43,Relational DBMS",ignite.apache.org,apacheignite.readme.io/docs,Apache Software Foundation,2015.0,Apache Ignite 2.6,Open Source,Apache 2.0,no,,"C++, Java, .Net","Linux,OS X,Solaris,Windows",yes,yes,yes,yes,"ANSI-99 for query and DML statements, subset of DDL","HDFS API,Hibernate,JCache,JDBC,ODBC,Proprietary protocol,RESTful HTTP API,Spring Data","C#,C++,Java,PHP,Python,Ruby,Scala",yes (compute grid and cache interceptors can be used instead),yes (cache interceptors and events),Sharding,yes (replicated cache),yes (compute grid and hadoop accelerator),Immediate Consistency,no,ACID,yes,yes,yes,Security Hooks for custom implementations
Riak KV,"Distributed, fault tolerant key-value store",Key-value store,,"Score,5.19,Rank,#79,Overall,#10,Key-value stores",riak.com/products/riak-kv,,Basho Technologies,2009.0,"2.1.0, April 2015",Open Source,"Apache version 2, commercial enterprise edition",no,,Erlang,"Linux,OS X",schema-free,no,no,restricted,no,"HTTP API,Native Erlang Interface","C,C#,C++,Clojure,Dart,Erlang,Go,Groovy,Haskell,Java,JavaScript,Lisp,Perl,PHP,Python,Ruby,Scala,Smalltalk",JavaScript and Erlang,yes,Sharding,selectable replication factor,yes,Eventual Consistency,no,no,yes,yes,,no
Accumulo,,Wide column store,,"Score,5.18,Rank,#80,Overall,#7,Wide column stores",accumulo.apache.org,,,2008.0,"2.0.1 (December 24, 2020), 2020",Open Source,,no,,Java,,,,,,,,,,,,,,,,,,,,
HyperSQL,,Relational DBMS,,"Score,5.15,Rank,#81,Overall,#44,Relational DBMS",hsqldb.org,,,2001.0,"2.7.1, October 2022",Open Source,based on BSD license,no,,Java,,,,,,,,,,,,,,,,,,,,
Adabas,,Multivalue DBMS,,"Score,5.10,Rank,#82,Overall,#1,Multivalue DBMS",www.softwareag.com/en_corporate/platform/adabas-natural.html,,,1971.0,,commercial,,no,,,,,,,,,,,,,,,,,,,,,,
Apache Jena - TDB,,RDF store,,"Score,5.07,Rank,#83,Overall,#3,RDF stores",jena.apache.org/documentation/tdb/index.html,,,2000.0,"4.6.1, September 2022",Open Source,"Apache License, Version 2.0",no,,Java,,,,,,,,,,,,,,,,,,,,
Google Cloud Bigtable,,"Key-value store,Wide column store",,"Score,4.91,Rank,#84,Overall,#11,Key-value stores,#8,Wide column stores",cloud.google.com/bigtable,,,2015.0,,commercial,,yes,,,,,,,,,,,,,,,,,,,,,,
ArangoDB,,"Document store,Graph DBMS,Key-value store,Search engine",,"Score,4.80,Rank,#85,Overall,#14,Document stores,#4,Graph DBMS,#12,Key-value stores,#10,Search engines",www.arangodb.com,,,2012.0,"3.9.3, September 2022",Open Source,Apache Version 2; Commercial license (Enterprise) available,no,"ArangoDB Oasis,–The Managed Cloud Service of ArangoDB. Oasis provides fully managed, and monitored cluster deployments of any size, with enterprise-grade security. Get started for free and continue for as little as $0,21/hour.",C++,,,,,,,,,,,,,,,,,,,,
"UniData,UniVerse",,Multivalue DBMS,,"Score,4.54,Rank,#86,Overall,#2,Multivalue DBMS",www.rocketsoftware.com/products/rocket-u2,,,1985.0,,commercial,,no,,C,,,,,,,,,,,,,,,,,,,,
TimescaleDB,,Time Series DBMS,,"Score,4.37,Rank,#87,Overall,#5,Time Series DBMS",www.timescale.com,,,2017.0,"2.6.0, February 2022",Open Source,Apache 2.0,no,,C,,,,,,,,,,,,,,,,,,,,
OpenEdge,,Relational DBMS,,"Score,4.33,Rank,#88,Overall,#45,Relational DBMS",www.progress.com/openedge,,,1984.0,"OpenEdge 12.2, March 2020",commercial,,no,,,,,,,,,,,,,,,,,,,,,,
RocksDB,,Key-value store,,"Score,4.30,Rank,#89,Overall,#13,Key-value stores",rocksdb.org,,,2013.0,"7.10.2, March 2023",Open Source,BSD,no,,C++,,,,,,,,,,,,,,,,,,,,
SAP IQ,,Relational DBMS,,"Score,4.13,Rank,#90,Overall,#46,Relational DBMS",www.sap.com/products/sybase-iq-big-data-management.html,,,1994.0,"16.1 SPS04, April 2019",commercial,,no,,,,,,,,,,,,,,,,,,,,,,
IBM Cloudant,,Document store,,"Score,4.09,Rank,#91,Overall,#15,Document stores",www.ibm.com/cloud/cloudant,,,2010.0,,commercial,,yes,,Erlang,,,,,,,,,,,,,,,,,,,,
OrientDB,,"Document store,Graph DBMS,Key-value store",,"Score,4.06,Rank,#92,Overall,#16,Document stores,#5,Graph DBMS,#14,Key-value stores",orientdb.org,,,2010.0,"3.1.9, February 2021",Open Source,Apache version 2,no,,Java,,,,,,,,,,,,,,,,,,,,
Google Cloud Spanner,,Relational DBMS,,"Score,4.01,Rank,#93,Overall,#47,Relational DBMS",cloud.google.com/spanner,,,2017.0,,commercial,,yes,,,,,,,,,,,,,,,,,,,,,,
RavenDB,,Document store,,"Score,3.97,Rank,#94,Overall,#17,Document stores",ravendb.net,,,2010.0,"5.4, July 2022",Open Source,"AGPL version 3, commercial license available",no,,C#,,,,,,,,,,,,,,,,,,,,
GemFire,,Key-value store,,"Score,3.96,Rank,#95,Overall,#15,Key-value stores",www.vmware.com/products/gemfire.html,,,2004.0,"9.15, June 2022",commercial,,no,,Java,,,,,,,,,,,,,,,,,,,,
Oracle NoSQL,,"Document store,Key-value store,Relational DBMS",,"Score,3.79,Rank,#96,Overall,#18,Document stores,#16,Key-value stores,#48,Relational DBMS",www.oracle.com/database/technologies/related/nosql.html,,,2011.0,"22.3, December 2022",Open Source,"Proprietary for Enterprise Edition (Oracle Database EE license has Oracle NoSQL database EE covered:,details,)",no,,Java,,,,,,,,,,,,,,,,,,,,
RethinkDB,,Document store,,"Score,3.76,Rank,#97,Overall,#19,Document stores",rethinkdb.com,,,2009.0,"2.4.1, August 2020",Open Source,Apache Version 2,no,,C++,,,,,,,,,,,,,,,,,,,,
YugabyteDB,,Relational DBMS,,"Score,3.54,Rank,#98,Overall,#49,Relational DBMS",www.yugabyte.com,,,2017.0,"2.17, December 2022",Open Source,Apache 2.0,no,"YugabyteDB Managed,is the fully managed database-as-a-service offering of YugabyteDB. Get started quickly, and effortlessly ensure continuous availability and limitless scale of your cloud native applications.",C and C++,,,,,,,,,,,,,,,,,,,,
Infinispan,,Key-value store,,"Score,3.45,Rank,#99,Overall,#17,Key-value stores",infinispan.org,,,2009.0,"14.0.7.Final, March 2023",Open Source,Apache Version 2,no,,Java,,,,,,,,,,,,,,,,,,,,
MaxDB,,Relational DBMS,,"Score,3.42,Rank,#100,Overall,#50,Relational DBMS",maxdb.sap.com,,,1984.0,"7.9.10 (January 2020), 2020",commercial,Limited community edition free,no,,C++,,,,,,,,,,,,,,,,,,,,
LevelDB,"Embeddable fast,key-value storage,library that provides an ordered mapping from string keys to string values",Key-value store,,"Score,3.38,Rank,#101,Overall,#18,Key-value stores",github.com/google/leveldb,github.com/google/leveldb/blob/master/doc/index.md,Google,2011.0,"1.23, February 2021",Open Source,BSD,no,,C++,"Illumos,Linux,OS X,Windows",schema-free,no,no,no,no,,"C++,Go,Java,JavaScript (Node.js),Python",no,no,none,none,no,Immediate Consistency,no,no,yes,yes,,no
Oracle Berkeley DB,Widely used in-process key-value store,"Key-value store,Native XML DBMS",,"Score,3.29,Rank,#102,Overall,#19,Key-value stores,#3,Native XML DBMS",www.oracle.com/technetwork/database/database-technologies/berkeleydb/overview/index.html,docs.oracle.com/cd/E17076_05/html/index.html,Oracle,1994.0,"18.1.40, May 2020",Open Source,commercial license available,no,,"C, Java, C++ (depending on the Berkeley DB edition)","AIX,Android,FreeBSD,iOS,Linux,OS X,Solaris,VxWorks,Windows",schema-free,no,yes,yes,yes,,".Net,others,C,C#,C++,Java,JavaScript (Node.js),Perl,Python,Tcl",no,yes,none,Source-replica replication,no,,no,ACID,,yes,yes,no
PouchDB,"JavaScript DBMS with an API inspired by,CouchDB",Document store,,"Score,3.27,Rank,#103,Overall,#20,Document stores",pouchdb.com,pouchdb.com/guides,Apache Software Foundation,2012.0,"7.1.1, June 2019",Open Source,,no,,JavaScript,"server-less, requires a JavaScript environment (browser, Node.js)",schema-free,no,no,yes,no,"HTTP REST,JavaScript API",JavaScript,View functions in JavaScript,yes,Sharding,"Multi-source replication,Source-replica replication",yes,Eventual Consistency,no,no,,yes,yes,no
InterSystems IRIS,"A containerised multi-model DBMS, interoperability and analytics data platform with wide capabilities for vertical and horizontal scalability","Document store,Key-value store,Object oriented DBMS,Relational DBMS",,"Score,3.20,Rank,#104,Overall,#21,Document stores,#20,Key-value stores,#1,Object oriented DBMS,#51,Relational DBMS",www.intersystems.com/products/intersystems-iris,docs.intersystems.com/irislatest/csp/docbook/DocBook.UI.Page.cls,InterSystems,2018.0,"2021.1, June 2021",commercial,,no,,,"AIX,Linux,macOS,Windows",depending on used data model,yes,yes,yes,yes,"JDBC,ODBC,RESTful HTTP API",".Net,C++,Java,JavaScript (Node.js),Python",yes,yes,Sharding,Source-replica replication,no,Immediate Consistency,yes,ACID,yes,yes,yes,yes
InterSystems Caché,A multi-model DBMS and application server,"Key-value store,Object oriented DBMS,Relational DBMS",,"Score,3.19,Rank,#105,Overall,#21,Key-value stores,#2,Object oriented DBMS,#52,Relational DBMS",www.intersystems.com/products/cache,docs.intersystems.com,InterSystems,1997.0,"2018.1.4, May 2020",commercial,,no,,,"AIX,HP Open VMS,HP-UX,Linux,OS X,Solaris,Windows",depending on used data model,yes,yes,yes,yes,".NET Client API,JDBC,ODBC,RESTful HTTP API","C#,C++,Java",yes,yes,none,Source-replica replication,no,Immediate Consistency,yes,ACID,yes,yes,yes,"Access rights for users, groups and roles"
RRDtool,Industry standard data logging and graphing tool for time series data. RRD is an acronym for round-robin database.,Time Series DBMS,,"Score,3.19,Rank,#106,Overall,#6,Time Series DBMS",oss.oetiker.ch/rrdtool,oss.oetiker.ch/rrdtool/doc,Tobias Oetiker,1999.0,"1.8.0, 2022",Open Source,GPL V2 and FLOSS,no,,C,"HP-UX,Linux",yes,Numeric data only,no,no,no,"in-process shared library,Pipes","C,C#,Java,JavaScript (Node.js),Lua,Perl,PHP,Python,Ruby",no,no,none,none,no,none,no,no,yes,yes,yes,no
EDB Postgres,"The EDB Postgres Platform is an enterprise-class data management platform based on the open source database,PostgreSQL,with flexible deployment options and,Oracle,compatibility features, complemented by tool kits for management, integration, and migration.",Relational DBMS,,"Score,3.15,Rank,#107,Overall,#53,Relational DBMS",www.enterprisedb.com,www.enterprisedb.com/edb-docs,EnterpriseDB,2005.0,"14, December 2021",commercial,BSD for PostgreSQL-components,no,,C,"Linux,Windows",yes,yes,yes,yes,yes,"ADO.NET,JDBC,native C library,ODBC,streaming API for large objects",".Net,C,C++,Delphi,Java,Perl,PHP,Python,Tcl",user defined functions,yes,horizontal partitioning,Multi-source replication,no,Immediate Consistency,yes,ACID,"yes, multi-version concurrency control (MVCC)",yes,no,fine grained access rights according to SQL-standard
HEAVY.AI,"A high performance, column-oriented,RDBMS,, specifically developed to harness the massive parallelism of modern CPU and GPU hardware",Relational DBMS,,"Score,3.15,Rank,#108,Overall,#54,Relational DBMS","github.com/heavyai/heavydb,www.heavy.ai",docs.heavy.ai,"HEAVY.AI, Inc.",2016.0,"5.10, January 2022",Open Source,Apache Version 2; enterprise edition available,no,,C++ and CUDA,Linux,yes,yes,no,no,yes,"JDBC,ODBC,Thrift,Vega","All languages supporting JDBC/ODBC/Thrift,Python",no,no,Sharding,Multi-source replication,no,Immediate Consistency,no,no,yes,yes,yes,fine grained access rights according to SQL-standard
Percona Server for MySQL,"Enhanced drop-in replacement for,MySQL,based on XtraDB or TokuDB storage engines with improved performance and additional diagnostic and management features.",Relational DBMS,,"Score,3.11,Rank,#109,Overall,#55,Relational DBMS",www.percona.com/software/mysql-database/percona-server,www.percona.com/downloads/Percona-Server-LATEST,Percona,2008.0,"8.0.28-20, 2022",Open Source,GPL version 2,no,,C and C++,Linux,yes,yes,yes,yes,yes,"ADO.NET,JDBC,ODBC","Ada,C,C#,C++,D,Eiffel,Erlang,Haskell,Java,Objective-C,OCaml,Perl,PHP,Python,Ruby,Scheme,Tcl",yes,yes,,"Multi-source replication,Source-replica replication,XtraDB Cluster",no,Immediate Consistency,yes,ACID,yes,yes,yes,Users with fine-grained authorization concept
Apache Phoenix,"A scale-out RDBMS with evolutionary schema built on,Apache HBase",Relational DBMS,,"Score,3.09,Rank,#110,Overall,#56,Relational DBMS",phoenix.apache.org,phoenix.apache.org,Apache Software Foundation,2014.0,"5.0-HBase2, July 2018 and 4.15-HBase1, December 2019",Open Source,Apache Version 2.0,no,,Java,"Linux,Unix,Windows",yes,yes,no,yes,yes,JDBC,"C,C#,C++,Go,Groovy,Java,PHP,Python,Scala",user defined functions,no,Sharding,"Multi-source replication,Source-replica replication",Hadoop integration,Immediate Consistency or Eventual Consistency,no,ACID,yes,yes,yes,"Access Control Lists (using HBase ACL) for RBAC, integration with Apache Ranger for RBAC & ABAC, multi-tenancy"
Apache Drill,"Schema-free SQL Query Engine for Hadoop, NoSQL and Cloud Storage","Document store,Relational DBMS",,"Score,3.09,Rank,#111,Overall,#22,Document stores,#57,Relational DBMS",drill.apache.org,drill.apache.org/docs,Apache Software Foundation,2012.0,"1.20.3, January 2023",Open Source,Apache Version 2,no,,,"Linux,OS X,Windows",schema-free,yes,no,no,SQL SELECT statement is SQL:2003 compliant,"JDBC,ODBC,RESTful HTTP API",C++,user defined functions,no,Sharding,,yes,none,no,no,yes,Depending on the underlying data source,Depending on the underlying data source,Depending on the underlying data source
IMS,,Navigational DBMS,,"Score,3.02,Rank,#112,Overall,#1,Navigational DBMS",www.ibm.com/software/data/ims,www.ibm.com/support/knowledgecenter/SSEPH2,IBM,1966.0,"15, October 2017",commercial,,no,,,,,,,,,,,,,,,,,,,,,,
LMDB,"A high performant, light-weight, embedded key-value database library",Key-value store,,"Score,2.98,Rank,#113,Overall,#22,Key-value stores",www.symas.com/symas-embedded-database-lmdb,,Symas,2011.0,"0.9.29, March 2021",Open Source,,no,,C,,schema-free,,no,no,no,,C,no,no,none,none,no,Immediate Consistency,no,ACID,yes,yes,yes,no
SAP Advantage Database Server,"Low-cost,RDBMS,with access to ISAM and FoxPro data structures",Relational DBMS,,"Score,2.90,Rank,#114,Overall,#58,Relational DBMS",www.sap.com/products/advantage-database-server.html,,"Sybase, SAP",1993.0,,commercial,,no,,,"Linux,Windows",yes,yes,no,yes,yes,".NET Client API,ADO.NET,JDBC,ODBC,OLE DB","Delphi,Perl,PHP",yes,yes,none,"Multi-source replication,Source-replica replication",no,Immediate Consistency,yes,ACID,yes,yes,no,fine grained access rights according to SQL-standard
TiDB,"TiDB is an open source distributed SQL database that supports Hybrid Transactional/Analytical Processing (HTAP) workloads. It is MySQL compatible and features horizontal scalability, strong consistency, and high availability.",Relational DBMS,,"Score,2.88,Rank,#115,Overall,#59,Relational DBMS",pingcap.com,docs.pingcap.com/tidb/stable,"PingCAP, Inc.",2016.0,"7.0.0, March 2023",Open Source,Apache 2.0,no,"TiDB Cloud,: Fully-managed TiDB Service. Bring everything great about TiDB to the cloud.","Go, Rust",Linux,yes,yes,no,yes,yes,"GORM,JDBC,ODBC,Proprietary protocol,SQLAlchemy","Ada,C,C#,C++,D,Delphi,Eiffel,Erlang,Haskell,Java,JavaScript (Node.js),Objective-C,OCaml,Perl,PHP,Python,Ruby,Scheme,Tcl",no,no,horizontal partitioning (by key range),Using Raft consensus algorithm to ensure data replication with strong consistency among multiple replicas.,yes,Immediate Consistency,yes,ACID,yes,yes,no,Fine grained access rights according to SQL-standard
CloudKit,,Document store,,"Score,2.78,Rank,#116,Overall,#23,Document stores",developer.apple.com/icloud/cloudkit,,,2016.0,,commercial,,yes,,,,,,,,,,,,,,,,,,,,,,
Apache Druid,Open-source analytics data store designed for sub-second OLAP queries on high dimensionality and high cardinality data,"Relational DBMS,Time Series DBMS",,"Score,2.76,Rank,#117,Overall,#60,Relational DBMS,#7,Time Series DBMS",druid.apache.org,druid.apache.org/docs/latest/design,Apache Software Foundation and contributors,2012.0,"25.0.0, January 2023",Open Source,Apache license v2,no,,Java,"Linux,OS X,Unix",yes,yes,no,yes,SQL for querying,"JDBC,RESTful HTTP/JSON API","Clojure,JavaScript,PHP,Python,R,Ruby,Scala",no,no,Sharding,"yes, via HDFS, S3 or other storage engines",no,Immediate Consistency,no,no,yes,yes,no,RBAC using LDAP or Druid internals for users and groups for read/write by datasource and system
4D,Application development environment with integrated database management system,Relational DBMS,,"Score,2.75,Rank,#118,Overall,#61,Relational DBMS",www.4d.com,livedoc.4d.com,"4D, Inc",1984.0,"v18 R5, January 2021",commercial,,no,,,"OS X,Windows",yes,yes,yes,yes,yes,"ODBC,RESTful HTTP API,SOAP webservices","4D proprietary IDE,PHP",yes,yes,none,Multi-source replication,no,Immediate Consistency,yes,ACID,yes,yes,no,Users and groups
EXASOL,"High-performance, in-memory, MPP database specifically designed for in-memory analytics.",Relational DBMS,,"Score,2.74,Rank,#119,Overall,#62,Relational DBMS",www.exasol.com,www.exasol.com/resources,Exasol,2000.0,,commercial,,no,,,,yes,yes,no,yes,yes,".Net,JDBC,ODBC,WebSocket","Java,Lua,Python,R",user defined functions,yes,Sharding,,yes,Immediate Consistency,yes,ACID,yes,yes,yes,"Access rights for users, groups and roles according to SQL-standard"
Geode,"Geode is a distributed data container, pooling memory, CPU, network resources, and optionally local disk across multiple processes",Key-value store,,"Score,2.73,Rank,#120,Overall,#23,Key-value stores",geode.apache.org,geode.apache.org/docs,Originally developed by Gemstone. They outsourced the project to Apache in 2015 but still deliver a commercial version as Gemfire.,2002.0,"1.1, February 2017",Open Source,Apache Version 2; commercial licenses available as Gemfire,no,,Java,All OS with a Java VM,schema-free,yes,no,no,SQL-like query language (OQL),"Java Client API,Memcached protocol,RESTful HTTP API",".Net,All JVM based languages,C++,Groovy,Java,Scala",user defined functions,yes,Sharding,Multi-source replication,no,Eventual Consistency,no,"yes, on a single node",yes,yes,yes,Access rights per client and object definable
Amazon Neptune,"Fast, reliable graph database built for the cloud","Graph DBMS,RDF store",,"Score,2.69,Rank,#121,Overall,#6,Graph DBMS,#4,RDF stores",aws.amazon.com/neptune,aws.amazon.com/neptune/developer-resources,Amazon,2017.0,,commercial,,yes,,,hosted,schema-free,yes,no,no,no,"RDF 1.1 / SPARQL 1.1,TinkerPop Gremlin 3.3","C#,Go,Java,JavaScript,PHP,Python,Ruby,Scala",no,no,none,"Multi-availability zones high availability, asynchronous replication for up to 15 read replicas",no,Immediate Consistency,yes,ACID,yes,yes,,Access rights for users and roles can be defined via the AWS Identity and Access Management (IAM)
Citus,Scalable hybrid operational and analytics RDBMS for big data use cases based on PostgreSQL,Relational DBMS,,"Score,2.66,Rank,#122,Overall,#63,Relational DBMS",www.citusdata.com,docs.citusdata.com,,2010.0,"8.1, December 2018",Open Source,"AGPL, commercial license also available",no,,C,Linux,yes,yes,yes,yes,yes,"ADO.NET,JDBC,native C library,ODBC,streaming API for large objects",".Net,C,C++,Delphi,Java,JavaScript (Node.js),Perl,PHP,Python,Tcl",user defined functions,yes,Sharding,Source-replica replication,no,Immediate Consistency,yes,ACID,yes,yes,no,fine grained access rights according to SQL-standard
DolphinDB,"DolphinDB is a high performance,Time Series DBMS,. It is integrated with an easy-to-use fully featured programming language and a high-volume high-velocity streaming analytics system. It offers operational simplicity, scalability, fault tolerance, and concurrency.",Time Series DBMS,,"Score,2.61,Rank,#123,Overall,#8,Time Series DBMS",www.dolphindb.com,www.dolphindb.com/help,"DolphinDB, Inc",2018.0,"v2.00.4, January 2022",commercial,free community version available,no,,C++,"Linux,Windows",yes,yes,no,yes,SQL-like query language,"JDBC,JSON over HTTP,Kafka,MQTT (Message Queue Telemetry Transport),ODBC,OPC DA,OPC UA,RabbitMQ,WebSocket","C#,C++,Go,Java,JavaScript,MatLab,Python,R,Rust",yes,no,horizontal partitioning,yes,yes,Immediate Consistency,no,yes,yes,yes,yes,"Administrators, Users, Groups"
TDengine,Time Series DBMS and big data platform,Time Series DBMS,,"Score,2.61,Rank,#124,Overall,#9,Time Series DBMS","github.com/taosdata/TDengine,tdengine.com",docs.tdengine.com,"TDEngine, previously Taos Data",2019.0,"3.0, August 2022",Open Source,"GPL V3, also commercial editions available",no,,C,"Linux,Windows",yes,yes,no,no,Standard SQL with extensions for time-series applications,"JDBC,RESTful HTTP API","C,C#,C++,Go,Java,JavaScript (Node.js),PHP,Python,Rust",no,"yes, via alarm monitoring",Sharding,yes,,,no,,yes,yes,,yes
Amazon SimpleDB,"Hosted simple database service by Amazon, with the data stored in the Amazon Cloud.",Key-value store,,"Score,2.58,Rank,#125,Overall,#24,Key-value stores",aws.amazon.com/simpledb,docs.aws.amazon.com/simpledb,Amazon,2007.0,,commercial,,yes,,,hosted,schema-free,no,,yes,no,RESTful HTTP API,".Net,C,C++,Erlang,Java,PHP,Python,Ruby,Scala",no,no,none,yes,no,"Eventual Consistency,Immediate Consistency",no,no,yes,yes,,Access rights for users and roles can be defined via the AWS Identity and Access Management (IAM)
DuckDB,"An embeddable, in-process, column-oriented SQL OLAP,RDBMS",Relational DBMS,,"Score,2.57,Rank,#126,Overall,#64,Relational DBMS",duckdb.org,duckdb.org/docs,,2018.0,"0.2, August 2020",Open Source,MIT License,no,,C++,server-less,yes,yes,no,yes,yes,"CLI Client,JDBC","C,C++,Go,Java,Python,R,Ruby",no,no,none,none,no,Immediate Consistency,no,ACID,"yes, multi-version concurrency control (MVCC)",yes,yes,no
Oracle Coherence,Oracles in-memory data grid solution,Key-value store,,"Score,2.50,Rank,#127,Overall,#25,Key-value stores",www.oracle.com/middleware/technologies/coherence.html,docs.oracle.com/en/middleware/standalone/coherence,Oracle,2007.0,"12c, September 2016",commercial,,no,,Java,All OS with a Java VM,schema-free,yes,no,no,no,"JCache,JPA,RESTful HTTP API",".Net,C++,Java",no,yes,Sharding,"yes, with selectable consistency level",no,"Eventual Consistency,Immediate Consistency",no,configurable,yes,yes,yes,authentification to access the cache via certificates or http basic authentication
JanusGraph,A Graph DBMS optimized for distributed clusters,Graph DBMS,,"Score,2.44,Rank,#128,Overall,#7,Graph DBMS",janusgraph.org,docs.janusgraph.org,"Linux Foundation; originally developed as,Titan,by Aurelius",2017.0,"0.6.3, February 2023",Open Source,Apache 2.0,no,,Java,"Linux,OS X,Unix,Windows",yes,yes,no,yes,no,"Java API,TinkerPop Blueprints,TinkerPop Frames,TinkerPop Gremlin,TinkerPop Rexster","Clojure,Java,Python",yes,yes,yes,yes,yes,"Eventual Consistency,Immediate Consistency",yes,ACID,yes,yes,,User authentification and security via Rexster Graph Server
GraphDB,"Enterprise-ready RDF and graph database with efficient reasoning, cluster and external index synchronization support. It supports also SQL JDBC access to Knowledge Graph and GraphQL over SPARQL.","Graph DBMS,RDF store",,"Score,2.33,Rank,#129,Overall,#8,Graph DBMS,#5,RDF stores",www.ontotext.com,graphdb.ontotext.com/documentation,Ontotext,2000.0,"10.2, February 2023",commercial,Some plugins of GraphDB Workbench are open sourced,no,,Java,"All OS with a Java VM,Linux,OS X,Windows",schema-free and OWL/RDFS-schema support; RDF shapes,yes,no,"yes, supports real-time synchronization and indexing in SOLR/Elastic search/Lucene and GeoSPARQL geometry data indexes",stored SPARQL accessed as SQL using Apache Calcite through JDBC/ODBC,"GeoSPARQL,GraphQL,GraphQL Federation,Java API,JDBC,RDF4J API,RDFS,RIO,Sail API,Sesame REST HTTP Protocol,SPARQL 1.1",".Net,C#,Clojure,Java,JavaScript (Node.js),PHP,Python,Ruby,Scala",well-defined plugin interfaces; JavaScript server-side extensibility,no,none,Multi-source replication,no,"Immediate Consistency, Eventual consistency (configurable in cluster mode per master or individual client request)",yes,ACID,yes,yes,,"Default Basic authentication through RDF4J client, or via Java when run with cURL, default token-based in the Workbench or via Rest API, optional access through OpenID or Kerberos single sign-on."
Amazon CloudSearch,A hosted search engine service by Amazon with the data stored in Amazons cloud,Search engine,,"Score,2.33,Rank,#130,Overall,#11,Search engines",aws.amazon.com/cloudsearch,docs.aws.amazon.com/cloudsearch,Amazon,2012.0,,commercial,,yes,,,hosted,yes,yes,,yes,no,HTTP API,,no,no,yes,yes,no,,no,no,yes,yes,,authentication via encrypted signatures
OceanBase,"A distributed, high available,RDBMS,compatible with,Oracle,and,MySQL",Relational DBMS,,"Score,2.33,Rank,#131,Overall,#65,Relational DBMS",open.oceanbase.com,open.oceanbase.com/docs,OceanBase,2011.0,"3.2.3, March 2022",Open Source,Commercial license available,no,,C++,Linux,yes,yes,no,yes,yes,"JDBC,ODBC,ODP.NET,Oracle Call Interface (OCI),Proprietary native API,Table API","Ada,C,C++,D,Delphi,Eiffel,Erlang,Haskell,Java,JavaScript (Node.js),Objective-C,OCaml,Perl,PHP,Python,Ruby,Scheme,Tcl","PL/SQL in oracle-compatible mode, MySQL Stored Procedure in mysql-compatible mode",yes,"horizontal partitioning (by hash, key, range, range columns, list, and list columns)",Multi-source replication using Paxos,no,Immediate Consistency,yes,ACID,yes,yes,,"Access rights for users, groups and roles according to SQL-standard"
Coveo,"AI-powered hosted search, recommendation and personalization platform providing tools for both low-code and full-code development",Search engine,,"Score,2.28,Rank,#132,Overall,#12,Search engines",www.coveo.com,docs.coveo.com,Coveo,2012.0,,commercial,,yes,,,hosted,"hybrid - fields need to be configured prior to indexing, but relationships can be exploited at query time without pre-configuration",yes,no,yes,no,RESTful HTTP API,"C#,Java,JavaScript,Python",no,yes,yes,yes,no,Immediate Consistency,yes,yes,yes,yes,,"granular access controls, API key management, content filters"
